{
 "id": "2026-09-10-acid-base",
 "date": "2026-09-10",
 "title": "Acid–Base Balance & Disorders",
 "instructor": "Nisa Lalani, DNP, RN",
 "course": "NURS 419 · Patho/Pharm I",
 "sources": [
  "slides.pptx",
  "transcript.pages"
 ],
 "tiers": {
  "1": "recall",
  "2": "application",
  "3": "ABG interpretation"
 },
 "practice": [
  {
   "id": "p-001",
   "tier": "1",
   "type": "mc",
   "stem": "The normal arterial pH range is:",
   "options": [
    "7.25–7.35",
    "7.35–7.45",
    "7.45–7.55",
    "35–45"
   ],
   "answer": "B",
   "rationale": "Blood is held slightly alkaline at 7.35–7.45 — a window of only 0.10. (Her trick: 7.35–7.45 pairs with PaCO2 35–45.)"
  },
  {
   "id": "p-002",
   "tier": "1",
   "type": "mc",
   "stem": "Which set of values is normal for PaCO2 and HCO3- respectively?",
   "options": [
    "22–26 mm Hg; 35–45 mEq/L",
    "35–45 mm Hg; 22–26 mEq/L",
    "7.35–7.45 mm Hg; 22–26 mEq/L",
    "35–45 mm Hg; 3–11 mEq/L"
   ],
   "answer": "B",
   "rationale": "PaCO2 35–45 mm Hg is the respiratory value; HCO3- 22–26 mEq/L is the metabolic value. 3–11 is the anion gap, which is not tested."
  },
  {
   "id": "p-003",
   "tier": "1",
   "type": "mc",
   "stem": "pH is a measure of the concentration of which ion?",
   "options": [
    "Potassium",
    "Bicarbonate",
    "Hydrogen",
    "Sodium"
   ],
   "answer": "C",
   "rationale": "\"Power/potential of hydrogen.\" More H+ = lower pH = more acidic."
  },
  {
   "id": "p-004",
   "tier": "1",
   "type": "mc",
   "stem": "A substance that can donate hydrogen ions is a(n):",
   "options": [
    "Base",
    "Buffer",
    "Acid",
    "Electrolyte"
   ],
   "answer": "C",
   "rationale": "Acid donates H+; base accepts H+; a buffer can do either and therefore resists changes in pH."
  },
  {
   "id": "p-005",
   "tier": "1",
   "type": "mc",
   "stem": "The primary buffer system of the extracellular fluid is the:",
   "options": [
    "Hemoglobin buffer",
    "Protein buffer",
    "Phosphate buffer",
    "Carbonic acid–bicarbonate buffer"
   ],
   "answer": "D",
   "rationale": "The bicarbonate system is \"the most important one to remember\"; hemoglobin and protein buffers are FYI only."
  },
  {
   "id": "p-006",
   "tier": "1",
   "type": "mc",
   "stem": "The body maintains the ratio of bicarbonate to carbonic acid at approximately:",
   "options": [
    "1 : 1",
    "1 : 20",
    "20 : 1",
    "10 : 1"
   ],
   "answer": "C",
   "rationale": "20 parts base to 1 part acid, because metabolism constantly generates acid that must be neutralized."
  },
  {
   "id": "p-007",
   "tier": "1",
   "type": "mc",
   "stem": "The most accurate sample for determining acid-base status is drawn from:",
   "options": [
    "A peripheral vein",
    "A central venous catheter",
    "An artery",
    "A capillary stick"
   ],
   "answer": "C",
   "rationale": "Arterial blood gives the accurate oxygenation and CO2 picture. Sites: radial, brachial, femoral, or an arterial line."
  },
  {
   "id": "p-008",
   "tier": "1",
   "type": "mc",
   "stem": "The word \"hypercapnia\" means:",
   "options": [
    "Low oxygen",
    "Excess CO2",
    "Low CO2",
    "Excess bicarbonate"
   ],
   "answer": "B",
   "rationale": "Hypercapnia = CO2 retained (respiratory acidosis). Hypocapnia = CO2 blown off (respiratory alkalosis). She put both in the same Kahoot to trick you."
  },
  {
   "id": "p-009",
   "tier": "1",
   "type": "mc",
   "stem": "ROME stands for:",
   "options": [
    "Respiratory Only, Metabolic Equal",
    "Respiratory Opposite, Metabolic Equal",
    "Renal Opposite, Metabolic Equal",
    "Respiratory Opposite, Metabolic Elevated"
   ],
   "answer": "B",
   "rationale": "In respiratory disorders pH and PaCO2 move in opposite directions; in metabolic disorders pH and HCO3- move together."
  },
  {
   "id": "p-010",
   "tier": "1",
   "type": "mc",
   "stem": "Which system compensates for an acid-base disorder more quickly?",
   "options": [
    "Kidneys",
    "Lungs",
    "Liver",
    "Both equally"
   ],
   "answer": "B",
   "rationale": "Lungs adjust \"relatively quick\"; kidneys are \"slow and steady,\" taking hours to days but fixing it \"for good.\""
  },
  {
   "id": "p-011",
   "tier": "1",
   "type": "mc",
   "stem": "The mnemonic DEPRES lists causes of:",
   "options": [
    "Metabolic acidosis",
    "Metabolic alkalosis",
    "Respiratory acidosis",
    "Respiratory alkalosis"
   ],
   "answer": "C",
   "rationale": "Drugs, Edema (pulmonary), Pneumonia, Respiratory alterations (stroke), Emphysema, Spasm of bronchioles (asthma/COPD) — all hypoventilation."
  },
  {
   "id": "p-012",
   "tier": "1",
   "type": "mc",
   "stem": "The mnemonic TACHYPNEA lists causes of:",
   "options": [
    "Respiratory alkalosis",
    "Respiratory acidosis",
    "Metabolic acidosis",
    "Metabolic alkalosis"
   ],
   "answer": "A",
   "rationale": "Temperature, Aspirin, Controlled ventilation, Hyperventilation, Yelp/anxiety, Pneumothorax, Neuro, Embolism, Altitude — all hyperventilation."
  },
  {
   "id": "p-013",
   "tier": "2",
   "type": "mc",
   "stem": "In acidosis, excess H+ moves into the cell. Which electrolyte change results?",
   "options": [
    "Hypokalemia",
    "Hyperkalemia",
    "Hyponatremia",
    "Hypocalcemia"
   ],
   "answer": "B",
   "rationale": "K+ leaves the cell to maintain electrical neutrality → hyperkalemia. H+ also displaces Ca++ from albumin → hypercalcemia. \"Hyper and hyper.\""
  },
  {
   "id": "p-014",
   "tier": "2",
   "type": "mc",
   "stem": "A patient in metabolic alkalosis is most at risk for which pair of electrolyte imbalances?",
   "options": [
    "Hyperkalemia and hypercalcemia",
    "Hypokalemia and hypercalcemia",
    "Hypokalemia and hypocalcemia",
    "Hyperkalemia and hypocalcemia"
   ],
   "answer": "C",
   "rationale": "H+ leaves the cell so K+ enters (hypokalemia); albumin sites free up and bind Ca++ (hypocalcemia → tetany, tingling). \"Hypo and hypo.\""
  },
  {
   "id": "p-015",
   "tier": "2",
   "type": "mc",
   "stem": "The nurse monitors the EKG of a patient with an acid-base disorder primarily because of shifts in which electrolyte?",
   "options": [
    "Sodium",
    "Calcium",
    "Chloride",
    "Potassium"
   ],
   "answer": "D",
   "rationale": "Both hyper- and hypokalemia cause EKG changes and can stop the heart. Telemetry may be the first clue."
  },
  {
   "id": "p-016",
   "tier": "2",
   "type": "mc",
   "stem": "A patient with chronic COPD breathes on 2 L of oxygen. A new resident orders 4 L via nasal cannula. The nurse's best action is to:",
   "options": [
    "Apply the 4 L as ordered",
    "Question the order because the patient's respiratory drive is regulated by chronically low O2 and high CO2",
    "Apply a non-rebreather instead",
    "Increase to 6 L until saturation reaches 98%"
   ],
   "answer": "B",
   "rationale": "COPD patients autoregulate to a hypoxic drive; over-oxygenating \"will get him in trouble.\" Her clinic examples sat at 82–85%; \"you won't get them above 90, maybe 92.\""
  },
  {
   "id": "p-017",
   "tier": "2",
   "type": "mc",
   "stem": "A post-operative patient is not waking from anesthesia as expected. The PACU nurse anticipates the ABG will show:",
   "options": [
    "Metabolic alkalosis",
    "Respiratory alkalosis",
    "Respiratory acidosis",
    "Metabolic acidosis"
   ],
   "answer": "C",
   "rationale": "Oversedation (fentanyl, Versed, opioids) → hypoventilation → CO2 retention. Anticipate naloxone as a reversal agent."
  },
  {
   "id": "p-018",
   "tier": "2",
   "type": "mc",
   "stem": "A patient with severe anxiety is breathing rapidly and complains of tingling in the fingers. Which is the priority nursing intervention?",
   "options": [
    "Administer high-flow oxygen",
    "Coach slow diaphragmatic breathing and use therapeutic communication",
    "Prepare for hemodialysis",
    "Administer sodium bicarbonate"
   ],
   "answer": "B",
   "rationale": "Respiratory alkalosis from hyperventilation; tingling is from low ionized calcium. REST: Rebreather/slow breathing, Electrolytes, Sedative if needed, Teach relaxation."
  },
  {
   "id": "p-019",
   "tier": "2",
   "type": "mc",
   "stem": "A patient has had severe diarrhea for three days. The nurse expects which acid-base disorder?",
   "options": [
    "Metabolic alkalosis",
    "Respiratory acidosis",
    "Metabolic acidosis",
    "Respiratory alkalosis"
   ],
   "answer": "C",
   "rationale": "Diarrhea loses bicarbonate → HCO3- deficit → relative excess of H+. \"This is an NCLEX question, and we will ask you.\""
  },
  {
   "id": "p-020",
   "tier": "2",
   "type": "mc",
   "stem": "A patient has had an NG tube to continuous suction for two days. The nurse expects which acid-base disorder?",
   "options": [
    "Metabolic acidosis",
    "Metabolic alkalosis",
    "Respiratory acidosis",
    "Respiratory alkalosis"
   ],
   "answer": "B",
   "rationale": "Suction (like vomiting) removes hydrochloric acid → loss of H+ → relative excess of bicarbonate."
  },
  {
   "id": "p-021",
   "tier": "2",
   "type": "mc",
   "stem": "A patient in diabetic ketoacidosis has deep, rapid respirations. The nurse interprets this as:",
   "options": [
    "Respiratory acidosis from CO2 retention",
    "Kussmaul respirations — the lungs compensating for metabolic acidosis by blowing off CO2",
    "Anxiety requiring a sedative",
    "A sign the acidosis has resolved"
   ],
   "answer": "B",
   "rationale": "Kussmaul breathing is the respiratory compensation for metabolic acidosis; do not suppress it."
  },
  {
   "id": "p-022",
   "tier": "2",
   "type": "mc",
   "stem": "A patient in DKA has a potassium of 5.8 mEq/L. After insulin is started, the nurse should monitor for:",
   "options": [
    "Hyperkalemia",
    "Hypokalemia",
    "Hypercalcemia",
    "Hypernatremia"
   ],
   "answer": "B",